<?xml version="1.0"?>
<!DOCTYPE Report
[
<!ELEMENT Report (General ,(Doc|BPT)) >
<!ATTLIST Report ver CDATA #REQUIRED tmZone CDATA #REQUIRED>

<!ELEMENT General ( DocLocation ) >
<!ATTLIST General productName CDATA #REQUIRED productVer CDATA #REQUIRED os CDATA #REQUIRED host CDATA #REQUIRED qcserver CDATA #IMPLIED qcproject CDATA #IMPLIED SolManSolutionId CDATA #IMPLIED SolManProjectId CDATA #IMPLIED SolManTestPlanId CDATA #IMPLIED SolManTestPackageId CDATA #IMPLIED SolManUserInfoData CDATA #IMPLIED  >

<!ELEMENT BPT (DName,Res,DVer?,TSet?,TInst?,NodeArgs,AdditionalInfo*,Doc*) >
<!ATTLIST BPT rID ID #REQUIRED >

<!ELEMENT Doc (DName,ConfName?,Res,DVer?,TSet?,TInst?,RunType?,DT?,AdditionalInfo*,Step*,DIter*,Step*,Action*,Doc*,Summary?,TestMaintenanceSummary*,NodeArgs?) >
<!ATTLIST Doc rID ID #REQUIRED type (Test|BC|BPTWrapperTest|Flow|Group|Action) "Test" productName CDATA #REQUIRED BCIter CDATA #IMPLIED >

<!ELEMENT RunType ( #PCDATA )>
<!ATTLIST RunType fmStep (False|True) "False" batch (False|True) "False" upDesc (False|True) "False" upChk (False|True) "False" upAS (False|True) "False">

<!ELEMENT DName ( #PCDATA ) >

<!ELEMENT ConfName ( #PCDATA ) >

<!ELEMENT Res ( #PCDATA ) >

<!ELEMENT AdditionalInfo (AdditionalDataName,AdditionalDataValue ) >

<!ELEMENT AdditionalDataName ( #PCDATA ) >

<!ELEMENT AdditionalDataValue ( #PCDATA ) >

<!ELEMENT DVer ( #PCDATA ) >

<!ELEMENT TSet ( #PCDATA ) >

<!ELEMENT TInst ( #PCDATA ) >

<!ELEMENT DIter (Step*,Action+,Summary?,NodeArgs)>
<!ATTLIST DIter rID ID #REQUIRED iterID CDATA #REQUIRED>

<!ELEMENT DocLocation ( #PCDATA )>

<!ELEMENT Action (AName,AIter*,(Step|HtmlStep|Action)*, Summary,ActionMaintenanceSummary*, NodeArgs ) >
<!ATTLIST Action rID ID #REQUIRED>

<!ELEMENT AIter ((Step|HtmlStep|Action)*,DataMapping?, Summary?,NodeArgs) >
<!ATTLIST AIter rID ID #REQUIRED iterID CDATA #REQUIRED isCountable (False|True) "False" >

<!ELEMENT AName ( #PCDATA ) >

<!ELEMENT TestMaintenanceSummary (ActionMaintenanceSummary*) >
<!ATTLIST TestMaintenanceSummary ObjectsAdded CDATA #REQUIRED ObjectsUpdated CDATA #REQUIRED StepsUpdated CDATA #REQUIRED StepsComments CDATA #REQUIRED><!ELEMENT ActionMaintenanceSummary (ObjectChange* ) >
<!ATTLIST ActionMaintenanceSummary Action CDATA #REQUIRED Objects CDATA #REQUIRED Updated CDATA #REQUIRED LinesTotal CDATA #REQUIRED Added CDATA #REQUIRED LinesUpdated CDATA #REQUIRED>

<!ELEMENT ObjectChange  (Hierarchy, PropertyChangeList* ) >
<!ATTLIST ObjectChange Operation CDATA #IMPLIED OriginalRepository CDATA #IMPLIED>

<!ELEMENT PropertyChangeList (PropertyDef*) >

<!ELEMENT PropertyDef (OriginalValue, NewValue) >
<!ATTLIST PropertyDef PropName CDATA #REQUIRED OriginRegularExpression (True|False) "False" NewRegularExpression (True|False) "False" AddedProperty (True|False) "False" >

<!ELEMENT OriginalValue ( #PCDATA )>

<!ELEMENT NewValue ( #PCDATA )>

<!ELEMENT Hierarchy  (ObjectName, Hierarchy*) >
<!ATTLIST Hierarchy MicClass CDATA #REQUIRED>

<!ELEMENT ObjectName  ( #PCDATA ) >

<!ELEMENT Step (Obj,Details,Time,TimeTick* ,(Step|HtmlStep|Doc)*, DataMapping?, NodeArgs) >
<!ATTLIST Step rID ID #REQUIRED retval CDATA #IMPLIED>

<!ELEMENT HtmlStep (HTML,TimeTick*,(Step|HtmlStep|Doc)*,NodeArgs) >
<!ATTLIST HtmlStep rID ID #REQUIRED >

<!ELEMENT Obj ( #PCDATA ) >
<!ATTLIST Obj plainTxt (False|True) "True">

<!ELEMENT Details ( #PCDATA ) >
<!ATTLIST Details plainTxt (False|True) "True">

<!ELEMENT Time ( #PCDATA ) >

<!ELEMENT HTML ( #PCDATA ) >

<!ELEMENT Disp ( #PCDATA ) >

<!ELEMENT TimeTick ( #PCDATA ) >

<!ELEMENT DataMapping ( DataMappedItem* )>
<!ELEMENT DataMappedItem EMPTY >
<!ATTLIST DataMappedItem dsName CDATA #REQUIRED >
<!ATTLIST DataMappedItem rowId CDATA #REQUIRED >

<!ELEMENT NodeArgs (Disp,TopPane?,BtmPane?,ExtendedInfo? )>
<!ATTLIST NodeArgs eType CDATA #REQUIRED icon CDATA #REQUIRED nRep CDATA #REQUIRED UserNote CDATA #IMPLIED filter (False|True) "True">
<!ATTLIST NodeArgs status (Passed|Failed|Done|Warning|Information) "Done">
<!ATTLIST NodeArgs iconSel CDATA #IMPLIED nType CDATA #IMPLIED MovieMarker CDATA "">
<!ATTLIST NodeArgs Source CDATA #IMPLIED SourceLine CDATA #IMPLIED StepFlowItemKey CDATA #IMPLIED >

<!ELEMENT TopPane (Path)>

<!ELEMENT BtmPane ( (Path|WR)?,ASHilite?)>
<!ATTLIST BtmPane vType CDATA "HTML">

<!ELEMENT Path ( #PCDATA ) >

<!ELEMENT ASHilite ( #PCDATA ) >

<!ELEMENT WR ( #PCDATA ) >

<!ELEMENT ExtendedInfo ( StepData ) >

<!ATTLIST ExtendedInfo StepType CDATA #REQUIRED>
<!ELEMENT DT (NodeArgs) >
<!ATTLIST DT rID ID #REQUIRED>

<!ELEMENT Summary (Param*)>
<!ATTLIST Summary sTime CDATA #IMPLIED eTime CDATA #IMPLIED passed CDATA #IMPLIED failed CDATA #IMPLIED warnings CDATA #IMPLIED retval CDATA #IMPLIED stopped (False|True) "False" >

<!ELEMENT Param (ParamName,ParamVal)+ >
<!ATTLIST Param paramInOut (In|Out) "In">

<!ELEMENT ParamName ( #PCDATA ) >

<!ELEMENT ParamVal ( #PCDATA ) >

]
>
<Report ver="2.0" tmZone="India Standard Time">
<General productName="Vugen" productVer="2023" os="" host="LAPTOP-GG8LIT1J"><DocLocation><![CDATA[C:\Users\Deekshith\Documents\VuGen\Scripts\Arabian_POC_Feb10]]></DocLocation></General>
<Doc rID="T1"   productName= "Vugen"  >
<DName><![CDATA[Arabian_POC_Feb10]]></DName>
<Res><![CDATA[result1]]></Res>
<Action rID="T2">
<AName><![CDATA[vuser_init]]></AName>
<Summary sTime="20-02-2026 - 11:59:13" eTime="20-02-2026 - 11:59:13" passed="0" failed="0" warnings="0" ></Summary>
<NodeArgs eType="StartAction" icon="2" nRep="5" >
<Disp><![CDATA[vuser_init Summary]]></Disp>
</NodeArgs>
</Action>
<DIter rID="T3" iterID="1" >
<Action rID="T4">
<AName><![CDATA[Action]]></AName>
<Step rID="T5">
<Obj plainTxt="False" ><![CDATA[Service: Set Max Html Param Len]]></Obj>
<Details plainTxt="False" ><![CDATA[<CENTER>Maximum length of a HTML string that can be retrieved and saved set to <STRONG><FONT COLOR=#00AF00>1000</FONT></STRONG> characters</CENTER>]]></Details>
<Time><![CDATA[20-02-2026 - 11:59:13]]></Time>
<TimeTick>1771568953</TimeTick>
<NodeArgs eType="General" icon="4" nRep="9" >
<Disp><![CDATA[Service: Set Max Html Param Len]]></Disp>
</NodeArgs>
</Step>
<Step rID="T6">
<Obj plainTxt="False" ><![CDATA[Service: Reg Find]]></Obj>
<Details plainTxt="False" ><![CDATA[<CENTER><STRONG><FONT COLOR=#00AF00>Text=Welcome To LoanIQ</FONT></STRONG></CENTER>]]></Details>
<Time><![CDATA[20-02-2026 - 11:59:13]]></Time>
<TimeTick>1771568953</TimeTick>
<NodeArgs eType="General" icon="5" nRep="10" >
<Disp><![CDATA[Service: Reg Find]]></Disp>
</NodeArgs>
</Step>
<Step rID="T7">
<Obj plainTxt="False" ><![CDATA[Url: LoanIQ]]></Obj>
<Details plainTxt="False" ><![CDATA[<CENTER><FONT COLOR=#FF0031>Step creation failed</CENTER>]]></Details>
<Time><![CDATA[20-02-2026 - 11:59:13]]></Time>
<TimeTick>1771568953</TimeTick>
<NodeArgs eType="General" icon="6" nRep="11" status="Failed" >
<Disp><![CDATA[Url: LoanIQ]]></Disp>
</NodeArgs>
</Step>
<Step rID="T8">
<Obj plainTxt="False" ><![CDATA[Script Aborted!]]></Obj>
<Details plainTxt="False" ><![CDATA[<CENTER><STRONG><FONT COLOR=#FF0031>Failed</FONT></STRONG></CENTER>]]></Details>
<Time><![CDATA[20-02-2026 - 11:59:13]]></Time>
<TimeTick>1771568953</TimeTick>
<NodeArgs eType="General" icon="1" nRep="12" status="Failed" >
<Disp><![CDATA[Script Aborted!]]></Disp>
</NodeArgs>
</Step>
<Summary sTime="20-02-2026 - 11:59:13" eTime="20-02-2026 - 11:59:13" passed="0" failed="2" warnings="0" ></Summary>
<NodeArgs eType="StartAction" icon="2" nRep="8" status="Failed" >
<Disp><![CDATA[Action Summary]]></Disp>
</NodeArgs>
</Action>
<NodeArgs eType="StartIteration" icon="3" nRep="7" status="Failed" >
<Disp><![CDATA[Arabian_POC_Feb10 Iteration 1 (Row 1)]]></Disp>
</NodeArgs>
</DIter>
<Action rID="T9">
<AName><![CDATA[vuser_end]]></AName>
<Summary sTime="20-02-2026 - 11:59:13" eTime="20-02-2026 - 11:59:13" passed="0" failed="0" warnings="0" ></Summary>
<NodeArgs eType="StartAction" icon="2" nRep="15" >
<Disp><![CDATA[vuser_end Summary]]></Disp>
</NodeArgs>
</Action>
<Summary sTime="20-02-2026 - 11:59:13" eTime="20-02-2026 - 11:59:13" passed="0" failed="2" warnings="0" ></Summary>
<NodeArgs eType="StartTest" icon="1" nRep="4" status="Failed" >
<Disp><![CDATA[Test Arabian_POC_Feb10 Summary]]></Disp>
</NodeArgs>
</Doc>
</Report>